
SQL> CREATE TABLE STUDENT(USN VARCHAR2(11), Name VARCHAR(20), DOB DATE, Semester int, Percentage DECIMAL);


SQL> DESC STUDENT
Name                                      Null?    Type
----------------------------------------- -------- ----------------------------
USN                                                VARCHAR2(11)
NAME                                               VARCHAR2(20)
DOB                                                DATE
SEMESTER                                           NUMBER(38)
PERCENTAGE                                         NUMBER(38)


SQL> INSERT INTO STUDENT VALUES('4SF21IS006', 'Akkil', TO_DATE('2003-03-07', 'yyyy-mm-dd'), 5, 85);
1 row created.
SQL> INSERT INTO STUDENT VALUES('4SF21IS022', 'Bharat', TO_DATE('2003-08-28', 'yyyy-mm-dd'), 5, 98);
1 row cReated.
SQL> INSERT INTO STUDENT VALUES('4SF21IS015', 'Ashish', TO_DATE('2003-09-23', 'yyyy-mm-dd'), 5, 95);
1 row created.
SQL> INSERT INTO STUDENT VALUES('4SF21IS020', 'Babith', TO_DATE('2003-05-15', 'yyyy-mm-dd'), 5, 89);
1 row created.
SQL> INSERT INTO STUDENT VALUES('4SF21IS038', 'Shashank', TO_DATE('2003-02-02', 'yyyy-mm-dd'), 5, 94);
1 row created.


SQL> SELECT COUNT(*) FROM STUDENT;

  COUNT(*)
----------
         5

SQL> SELECT AVG(Percentage) FROM STUDENT;

AVG(PERCENTAGE)
---------------
           92.2

SQL> SELECT MIN(Percentage) as lowest, MAX(Percentage) as Highest FROM STUDENT;

    LOWEST    HIGHEST
---------- ----------
        85         98


SQL> SELECT Name, Percentage FROM STUDENT;

NAME                 PERCENTAGE
-------------------- ----------
Akkil                        85
Bharat                       98
Ashish                       95
Babith                       89
Shashank                     94



SQL>  UPDATE STUDENT SET Name='Akkil M G' WHERE USN='4SF21IS006';

1 row updated.


SQL> SELECT * FROM STUDENT WHERE USN='4SF21IS006';

USN         NAME                 DOB         SEMESTER PERCENTAGE
----------- -------------------- --------- ---------- ----------
4SF21IS006  Akkil            07-MAR-03          5         85
